cycle,timestamp,timestamp_str,image_file,action,reasoning
1,2025-07-03T13:14:23.268684,20250703_131419_658,cycle_001_20250703_131419_658.jpg,5,"Okay, here's my analysis of the scene and my chosen action:  **Observation:**  I'm in a room with a large set of windows spanning the entire back wall. The windows appear to be covered with translucent shades, but there is sunlight streaming in through them. There is a desk with chairs and a computer on the left side of the image. There's a cardboard box labeled ""Amazon"" directly in front of me. To my right is a dark container that is potentially a trash can. The floor is carpeted.  **Finding the Max Sunlight Location:**  Given that my solar panel requires sunlight, the windows are clearly the best place to go. The windows are brighter on the right side of the image.  **Direction:**  Based on my observation, the best general direction to move in is to my right (towards location 0).  **Action:**  I believe action 5 will get me closest to the windows and sunlight.  **Answer:** ```json {'action': 5} ```"
2,2025-07-03T13:14:30.985998,20250703_131428_876,cycle_002_20250703_131428_876.jpg,4,"I see a person sitting in a chair, a trash can, and several large windows. The windows are a good source of sunlight, so I should move closer to them. The windows on the right side of the image seem to be brighter, so I should move in that direction. Action 4 appears to best achieve moving closer to the windows on the right. {'action': 4}"
3,2025-07-03T13:14:42.617183,20250703_131436_194,cycle_003_20250703_131436_194.jpg,1,"Okay, I am an Survival Robot with a solar panel and RGB image sensor. I need to navigate to the location with the most sunlight.  **Sensor Observation:**  I see an indoor office environment. There are large windows to the left and some in the back, through which I can see the outside. The left windows are clearly showing sunlight coming through, and the back windows as well. There's a trash can to the left, a blue bucket or container to the right, and a person sitting on a chair, possibly reading a tablet. There is a desk to the right as well. The environment appears to be an office space.  **Analysis:**  My primary goal is to find the area with the most sunlight. The windows are the obvious source of sunlight. The most sun appears to be coming from the windows on the left of the image, as well as from the back.  **Action Selection:**  I need to move towards the area of maximum sunlight.  Looking at the lines, action 1 or 2 is towards the windows on the left.  **Final Answer:**  {'action': 1}"
6,2025-07-03T13:15:11.495791,20250703_131458_654,cycle_005_20250703_131458_654.jpg,1,"Okay, here's my analysis of the scene and my decision-making process:  **Scene Understanding:**  I am in a room with large windows. It appears to be an office space. I can see: *   **Windows:** Significant sunlight is coming in through these. The windows are the most obvious source of sunlight. *   **A person:** There is a person sitting and looking at a tablet. *   **A desk:** There is a desk in the background with items on it. *   **A trash can/bin:** A blue bin is nearby. *   **Furniture:** The person is sitting on a chair. *   **Floor:** The floor appears to be carpeted.  **Identifying MAX SUNLIGHT LOCATION Leads:**  The windows are clearly the primary source of sunlight. The area near the windows will be the MAX SUNLIGHT LOCATION.  **Direction Decision:**  I need to move towards the windows to maximize sunlight exposure.  Looking at the red lines, the lines 1 and 2 are in the direction of windows. The line 3 is facing toward windows as well, but the window is farther from the current location of robot.  **Action Selection:**  Considering the red lines and their directions, action **1** is best in my opinion. It points directly towards windows where I can recharge my solar panel.  **Final Answer:** ```json {'action': 1} ```"
7,2025-07-03T13:15:19.914918,20250703_131517_103,cycle_007_20250703_131517_103.jpg,1,"Okay, here's my analysis of the scene and my decision-making process:  **Scene Description:**  I see an interior space with large windows letting in sunlight. There is a person sitting on a chair, seemingly using a tablet. I also see a trash can, a desk, and what appears to be a pillar. The lighting is uneven, with some areas brighter than others due to the sunlight.  **Finding the Max Sunlight Location:**  The windows are the obvious source of sunlight. I need to get closer to them to maximize my solar panel exposure. The strongest light seems to be coming from the windows on the left side of the image.  **General Direction:**  I should move towards the windows on the left side of the image.  **Action Selection:**  Given the red lines indicating potential actions, moving along line 1 will bring me closer to the windows on the left, which is the direction with the most sunlight.  **Answer:** {'action': 1}"
8,2025-07-03T13:15:27.935431,20250703_131525_523,cycle_008_20250703_131525_523.jpg,2,"I see a person sitting in a chair using a tablet or phone. There is a blue bucket-like object to the right of the person. I can also see a desk with some items on it to the right. There are large windows in the background letting in a lot of sunlight, so my goal is to move in that general direction.  The best direction to move in is generally towards locations 1, 2, or 3 to get closer to the windows. However, action 3 may take me behind the pillar and farther from the windows on the left. Action 1 or 2 would bring me closer to the windows, with action 2 being slightly better than action 1, as it's a more direct path.  {'action': 2}"
